<?xml version="1.0" encoding="UTF-8" ?>
<!ELEMENT users (user)*>
<!ELEMENT user (email, bar)>
<!ATTLIST user nick_name ID #REQUIRED>
<!ELEMENT email (#PCDATA)>
<!ELEMENT bar (id)*>
<!ELEMENT id (#PCDATA)>